Time Series Prediction with LSTM Recurrent Neural Networks in Python with Keras July 21, 2016
Your First Machine Learning Project in Python Step_By_Step June 10, 2016
Develop Your First Neural Network in Python With Keras Step_By_Step May 24, 2016
Sequence Classification with LSTM Recurrent Neural Networks in Python with Keras July 26, 2016
Multi_Class Classification Tutorial with the Keras Deep Learning Library June 2, 2016
How to Run Your First Classifier in Weka February 17, 2014
Regression Tutorial with the Keras Deep Learning Library in Python June 9, 2016
A Tour of Machine Learning Algorithms November 25, 2013
Tutorial To Implement k_Nearest Neighbors in Python From Scratch September 12, 2014
How to Implement the Backpropagation Algorithm From Scratch In Python November 7, 2016


v
t
e




