examples of debuggers;http://searchsoftwarequality.techtarget.com/definition/debugging;The Art of Debugging ;Art;art;0.25000000000000006;0.016812512919451527;1.0;1.2668125129194516;0.0;1;Thu Jun 22 04:51:04 IST 2017;0;
examples of debuggers;http://searchsoftwarequality.techtarget.com/definition/debugging;Beware the dreaded scourge of cloud sprawl  Act now or lose control The cloud was supposed to save us  So, why are we now suffering from dreaded cloud sprawl, and what should we do about it  Cloud    ;Suffering;suffering;0.25000000000000006;0.016812512919451527;1.0;1.2668125129194516;0.0;1;Thu Jun 22 04:51:04 IST 2017;0;
examples of debuggers;http://searchsoftwarequality.techtarget.com/definition/debugging;Meet The Editors;Editing;editor;0.25000000000000006;0.016812512919451527;1.0;1.2668125129194516;0.0;1;Thu Jun 22 04:51:04 IST 2017;0;
examples of debuggers;http://searchsoftwarequality.techtarget.com/definition/debugging;Archive;Xarchiver;xarchiver;0.25000000000000006;0.016812512919451527;1.0;1.2668125129194516;0.0;1;Thu Jun 22 04:51:04 IST 2017;0;
examples of debuggers;https://en.wikipedia.org/wiki/Debugger; For example, the program might have tried to use an instruction not available on the current version of the CPU or attempted to access unavailable or protected memory;Central processing unit;cpu;0.25000000000000006;0.0;1.0;1.25;0.0;1;Thu Jun 22 04:51:04 IST 2017;1;All articles needing additional references
examples of debuggers;https://en.wikipedia.org/wiki/Debugger; If it is a low_level debugger or a machine_language debugger it shows the line in the disassembly ;Disassembler;disassembly;0.25000000000000006;0.0;1.0;1.25;0.0;1;Thu Jun 22 04:51:04 IST 2017;2;All articles lacking in-text citations::Debugging
examples of debuggers;https://en.wikipedia.org/wiki/Debugger;NET, and some other languages, but not C  ;Language;languages;0.25000000000000006;0.0;1.0;1.25;0.0;1;Thu Jun 22 04:51:04 IST 2017;0;
examples of debuggers;https://en.wikipedia.org/wiki/Debugger; For example, if the main target program is written in COBOL but calls assembly language subroutines and PL 1 subroutines, the debugger may have to dynamically switch modes to accommodate the changes in language as they occur;Language;language;0.25000000000000006;0.0;1.0;1.25;0.0;1;Thu Jun 22 04:51:04 IST 2017;0;
examples of debuggers;https://en.wikipedia.org/wiki/Debugger; For example, if the main target program is written in COBOL but calls assembly language subroutines and PL 1 subroutines, the debugger may have to dynamically switch modes to accommodate the changes in language as they occur;COBOL;cobol;0.25000000000000006;0.0;1.0;1.25;0.0;1;Thu Jun 22 04:51:04 IST 2017;0;
examples of debuggers;https://en.wikipedia.org/wiki/Debugger; Micro controllers with as few as six pins need to use low pin_count substitutes for JTAG, such as BDM, Spy_Bi_Wire, or debugWIRE on the Atmel AVR;JTAG;jtag;0.25000000000000006;0.0;1.0;1.25;0.0;1;Thu Jun 22 04:51:04 IST 2017;1;All articles needing additional references
examples of debuggers;https://en.wikipedia.org/wiki/Debugger;Donate to Wikipedia;Wikipedia;wikipedia;0.25000000000000006;0.0;1.0;1.25;0.0;1;Thu Jun 22 04:51:04 IST 2017;0;
examples of debuggers;https://en.wikipedia.org/wiki/Debugger;Download as PDF;Portable Document Format;pdf;0.25000000000000006;0.0;1.0;1.25;0.0;1;Thu Jun 22 04:51:04 IST 2017;1;CS1 maint: Uses authors parameter
examples of debuggers;https://en.wikipedia.org/wiki/List_of_debuggers;FusionDebug   interactive debugger for Adobe ColdFusion, Railo, and Lucee CFML Engines;Railo;railo;0.25000000000000006;0.0;1.0;1.25;0.0;1;Thu Jun 22 04:51:04 IST 2017;0;
examples of debuggers;https://en.wikipedia.org/wiki/List_of_debuggers;Modular Debugger a C C   source level debugger for Solaris and derivates;Solaria;solaria;0.25000000000000006;0.0;1.0;1.25;0.0;1;Thu Jun 22 04:51:04 IST 2017;0;
examples of debuggers;https://en.wikipedia.org/wiki/List_of_debuggers;Omniscient Debugger   Forward and backward debugger for Java;Java;java;0.25000000000000006;0.0;1.0;1.25;0.0;1;Thu Jun 22 04:51:04 IST 2017;0;
examples of debuggers;https://en.wikipedia.org/wiki/List_of_debuggers;GDB GUI Emacs   Emacs editor with built_in support for the GNU Debugger acts as the frontend  KDbg   Part of the KDE development tools  Nemiver   A GDB frontend that integrates well in the GNOME desktop environment  xxgdb   X_window frontend for GDB and dbx debugger  Qt Creator   multi_platform frontend for GDB, CDB and LLDB  Allinea s DDT   a parallel and distributed front_end to a modified version of GDB  Xcode   contains a GDB front_end as well  SlickEdit   contains a GDB front_end as well  Eclipse C C   Development Tools  2    includes visual debugging tools based on GDB  CodeLite   An open source, cross platform C C   IDE which have front end for gdb, the next version of CodeLite will also include a front end to the LLDB CodeBlocks   A free cross_platform C, C   and Fortran IDE with a front end for gdb  RR   An open source C C   debugger by Mozilla, supporting reproduction of program state and reverse execution;Mozilla;mozilla;0.25000000000000006;0.0;1.0;1.25;0.0;1;Thu Jun 22 04:51:04 IST 2017;0;
examples of debuggers;https://docs.microsoft.com/en-us/windows-hardware/drivers/debugger/debugger-command-program-examples;Blog;Blog;blog;0.25000000000000006;0.0;1.0;1.25;0.0;1;Thu Jun 22 04:51:04 IST 2017;0;
examples of debuggers;https://docs.microsoft.com/en-us/windows-hardware/drivers/debugger/debugger-command-program-examples;Feedback;Feedback;feedback;0.25000000000000006;0.0;1.0;1.25;0.0;1;Thu Jun 22 04:51:04 IST 2017;0;
examples of debuggers;https://www.w3schools.com/js/js_debugging.asp; The first known computer bug was a real bug stuck in the electronics;Electronics;electronics;0.25000000000000006;0.0;1.0;1.25;0.0;1;Thu Jun 22 04:51:04 IST 2017;1;All articles needing additional references
examples of debuggers;https://www.w3schools.com/js/js_debugging.asp;HTML, CSS, JavaScript, PHP, jQuery, Bootstrap and XML;JQuery;jquery;0.25000000000000006;0.0;1.0;1.25;0.0;1;Thu Jun 22 04:51:04 IST 2017;0;
examples of debuggers;https://www.w3schools.com/js/js_debugging.asp;HTML, CSS, JavaScript, PHP, jQuery, Bootstrap and XML;XML;xml;0.25000000000000006;0.0;1.0;1.25;0.0;1;Thu Jun 22 04:51:04 IST 2017;0;
examples of debuggers;https://www.w3schools.com/js/js_debugging.asp;HTML, CSS, JavaScript, PHP, jQuery, Bootstrap and XML;HTML;html;0.25000000000000006;0.0;1.0;1.25;0.0;1;Thu Jun 22 04:51:04 IST 2017;0;
examples of debuggers;https://www.w3schools.com/js/js_debugging.asp;HTML, CSS, JavaScript, PHP, jQuery, Bootstrap and XML;PHP;php;0.25000000000000006;0.0;1.0;1.25;0.0;1;Thu Jun 22 04:51:04 IST 2017;0;
examples of debuggers;https://www.w3schools.com/js/js_debugging.asp;HTML, CSS, JavaScript, PHP, jQuery, Bootstrap and XML;Cascading Style Sheets;css;0.25000000000000006;0.0;1.0;1.25;0.0;1;Thu Jun 22 04:51:04 IST 2017;0;
examples of debuggers;http://searchsoftwarequality.techtarget.com/definition/debugging;Debugging, in computer programming and engineering, is a multistep process that involves identifying a problem, isolating the source of the problem, and then either correcting the problem or determining a way to work around it;Engineering;engineering;0.25000000000000006;0.0;1.0;1.25;0.0;1;Thu Jun 22 04:51:04 IST 2017;1;All articles needing additional references
examples of debuggers;http://searchsoftwarequality.techtarget.com/definition/debugging;org improved application performance management to fine tune their website, increase donations, and make a ;Website;websites;0.25000000000000006;0.0;1.0;1.25;0.0;1;Thu Jun 22 04:51:04 IST 2017;0;
examples of debuggers;http://searchsoftwarequality.techtarget.com/definition/debugging;How is big data and IT helping the agriculture industry  By looking at information in new ways, technology is helping to improve ;Information;information;0.25000000000000006;0.0;1.0;1.25;0.0;1;Thu Jun 22 04:51:04 IST 2017;0;
examples of debuggers;http://searchsoftwarequality.techtarget.com/definition/debugging;Red Hat adds to its OpenShift;OpenShift;openshift;0.25000000000000006;0.0;1.0;1.25;0.0;1;Thu Jun 22 04:51:04 IST 2017;0;
examples of debuggers;http://searchsoftwarequality.techtarget.com/definition/debugging;While much of the developer community turns to Kubernetes to schedule containers, open source AWS Blox could carve out a niche ;Kubernetes;kubernetes;0.25000000000000006;0.0;1.0;1.25;0.0;1;Thu Jun 22 04:51:04 IST 2017;0;
examples of debuggers;http://searchsoftwarequality.techtarget.com/definition/debugging;Lenovo and Autodesk are two organizations that are increasing their use of the cloud for analytics applications, looking to lower;Organization;organization;0.25000000000000006;0.0;1.0;1.25;0.0;1;Thu Jun 22 04:51:04 IST 2017;1;All articles lacking in-text citations
examples of debuggers;http://searchsoftwarequality.techtarget.com/definition/debugging;ALM;Alms;alms;0.25000000000000006;0.0;1.0;1.25;0.0;1;Thu Jun 22 04:51:04 IST 2017;0;
examples of debuggers;http://searchsoftwarequality.techtarget.com/definition/debugging;QUEST speakers confirm mobile test automation vital for performance;Performance;performance;0.25000000000000006;0.0;1.0;1.25;0.0;1;Thu Jun 22 04:51:04 IST 2017;0;
examples of debuggers;http://www.sfu.ca/sasdoc/sashtml/lgref/z0379345.htm;   Most debugger commands have abbreviations, and you can assign commands to function keys;Abbreviation;abbreviations;0.25000000000000006;0.0;1.0;1.25;0.0;1;Thu Jun 22 04:51:04 IST 2017;1;All articles needing additional references
examples of debuggers;http://www.cprogramming.com/gdb.html; On a UNIX or Linux system, GDB is a powerful and popular debugging tool  it lets you do whatever you like with your program running under GDB;Unix;unix;0.25000000000000006;0.0;1.0;1.25;0.0;1;Thu Jun 22 04:51:04 IST 2017;1;All articles needing additional references
examples of debuggers;http://www.cprogramming.com/gdb.html;Gcc is the de facto compiler in Linux or any other  nix system;Linux;linux;0.25000000000000006;0.0;1.0;1.25;0.0;1;Thu Jun 22 04:51:04 IST 2017;0;
examples of debuggers;http://www.cprogramming.com/gdb.html;You have now seen enough to try GBD out on your own;GBDE;gbde;0.25000000000000006;0.0;1.0;1.25;0.0;1;Thu Jun 22 04:51:04 IST 2017;0;
examples of debuggers;http://www.cprogramming.com/gdb.html;After learning about GDB, you do not have to panic the next time your program goes crazy;Learning;learning;0.25000000000000006;0.0;1.0;1.25;0.0;1;Thu Jun 22 04:51:04 IST 2017;1;All articles needing additional references
examples of debuggers;https://en.wikipedia.org/wiki/List_of_debuggers;GDB GUI Emacs   Emacs editor with built_in support for the GNU Debugger acts as the frontend  KDbg   Part of the KDE development tools  Nemiver   A GDB frontend that integrates well in the GNOME desktop environment  xxgdb   X_window frontend for GDB and dbx debugger  Qt Creator   multi_platform frontend for GDB, CDB and LLDB  Allinea s DDT   a parallel and distributed front_end to a modified version of GDB  Xcode   contains a GDB front_end as well  SlickEdit   contains a GDB front_end as well  Eclipse C C   Development Tools  2    includes visual debugging tools based on GDB  CodeLite   An open source, cross platform C C   IDE which have front end for gdb, the next version of CodeLite will also include a front end to the LLDB CodeBlocks   A free cross_platform C, C   and Fortran IDE with a front end for gdb  RR   An open source C C   debugger by Mozilla, supporting reproduction of program state and reverse execution;Open-source model;open_source;0.6250000000000001;0.21606304790578237;0.32142857142857145;1.162491619334354;0.0;1;Thu Jun 22 04:51:04 IST 2017;0;
examples of debuggers;https://en.wikipedia.org/wiki/Debugger; An instruction set that meets the Popek and Goldberg virtualization requirements makes it easier to write debugger software that runs on the same CPU as the software being debugged  such a CPU can execute the inner loops of the program under test at full speed, and still remain under debugger control;Software;software;0.6250000000000001;0.10662005680576798;0.32142857142857145;1.0530486282343396;0.0;1;Thu Jun 22 04:51:04 IST 2017;0;
examples of debuggers;https://en.wikipedia.org/wiki/Debugger;Text is available under the Creative Commons Attribution_ShareAlike License  additional terms may apply  By using this site, you agree to the Terms of Use and Privacy Policy  Wikipedia  is a registered trademark of the Wikimedia Foundation, Inc , a non_profit organization ;Nonprofit organization;nonprofit_organization;0.6250000000000001;0.05331002840288399;0.32142857142857145;0.9997385998314556;0.0;1;Thu Jun 22 04:51:04 IST 2017;1;CS1 maint: Uses authors parameter
examples of debuggers;https://www.w3schools.com/js/js_debugging.asp;After examining values, you can resume the execution of code ;Capital punishment;execution;0.25000000000000006;0.2392938868911409;0.4910714285714286;0.9803653154625696;0.0;1;Thu Jun 22 04:51:04 IST 2017;2;All articles needing additional references::CS1 maint: Uses authors parameter
examples of debuggers;https://www.w3schools.com/js/js_debugging.asp;Errors can happen, every time you write some new computer code;Error;error;0.25000000000000006;0.4785877737822818;0.23660714285714288;0.9651949166394248;0.0;1;Thu Jun 22 04:51:04 IST 2017;0;
examples of debuggers;https://www.tutorialspoint.com/gnu_debugger/gdb_debugging_examples.htm;Home;Homer;homer;0.25000000000000006;0.18944099378881987;0.4910714285714286;0.9305124223602486;0.0;1;Thu Jun 22 04:51:04 IST 2017;0;
examples of debuggers;https://www.tutorialspoint.com/gnu_debugger/gdb_debugging_examples.htm;Videos;Video;video;0.25000000000000006;0.18944099378881987;0.4910714285714286;0.9305124223602486;0.0;1;Thu Jun 22 04:51:04 IST 2017;1;All articles needing additional references
examples of debuggers;https://www.tutorialspoint.com/gnu_debugger/gdb_debugging_examples.htm;Write for us;Writer;writer;0.25000000000000006;0.18944099378881987;0.4910714285714286;0.9305124223602486;0.0;1;Thu Jun 22 04:51:04 IST 2017;0;
examples of debuggers;https://www.tutorialspoint.com/gnu_debugger/gdb_debugging_examples.htm;Contact;Contactee;contactee;0.25000000000000006;0.18944099378881987;0.4910714285714286;0.9305124223602486;0.0;1;Thu Jun 22 04:51:04 IST 2017;0;
examples of debuggers;http://searchsoftwarequality.techtarget.com/definition/debugging;For Brent Shafer, CEO of Philips North America, the name of the health IT game is connected care;Game;game;0.25000000000000006;0.033625025838903054;0.4910714285714286;0.7746964544103316;0.0;1;Thu Jun 22 04:51:04 IST 2017;0;
examples of debuggers;https://en.wikipedia.org/wiki/Debugger; In_system programming allows an external hardware debugger to reprogram a system under test ;System;system;0.25000000000000006;0.026655014201441996;0.4910714285714286;0.7677264427728707;0.0;1;Thu Jun 22 04:51:04 IST 2017;0;
examples of debuggers;https://en.wikipedia.org/wiki/Debugger;Articles with too many examples;Particle;particles;0.25000000000000006;0.026655014201441996;0.4910714285714286;0.7677264427728707;0.0;1;Thu Jun 22 04:51:04 IST 2017;0;
examples of debuggers;https://en.wikipedia.org/wiki/Debugger;Related changes;Related;related;0.25000000000000006;0.026655014201441996;0.4910714285714286;0.7677264427728707;0.0;1;Thu Jun 22 04:51:04 IST 2017;0;
examples of debuggers;https://en.wikipedia.org/wiki/Debugger;Create a book;Book;books;0.25000000000000006;0.026655014201441996;0.4910714285714286;0.7677264427728707;0.0;1;Thu Jun 22 04:51:04 IST 2017;1;All articles needing additional references
examples of debuggers;https://en.wikipedia.org/wiki/Debugger;Download as PDF;Download;download;0.25000000000000006;0.026655014201441996;0.4910714285714286;0.7677264427728707;0.0;1;Thu Jun 22 04:51:04 IST 2017;0;
examples of debuggers;https://www.w3schools.com/js/js_debugging.asp;Otherwise follow these steps;Fellow;fellow;0.25000000000000006;0.3190585158548545;0.18571428571428575;0.7547728015691403;0.0;1;Thu Jun 22 04:51:04 IST 2017;0;
examples of debuggers;http://www.sfu.ca/sasdoc/sashtml/lgref/z0379345.htm;At the DEBUGGER LOG command line, issue the EXAMINE command to display the values of all variables in the program data vector before execution begins;Display device;displays;0.25000000000000006;0.08660159716060338;0.32142857142857145;0.658030168589175;0.0;1;Thu Jun 22 04:51:04 IST 2017;0;
examples of debuggers;http://www.sfu.ca/sasdoc/sashtml/lgref/z0379345.htm; The AFTER option requires a number that indicates how many times the loop will iterate before it reaches the breakpoint;Number;number;0.25000000000000006;0.08660159716060338;0.32142857142857145;0.658030168589175;0.0;1;Thu Jun 22 04:51:04 IST 2017;0;
examples of debuggers;https://www.w3schools.com/js/js_debugging.asp; There are no error messages, and you will get no indications where to search for errors;Isearch;isearch;0.25000000000000006;0.15952925792742725;0.23660714285714288;0.6461364007845702;0.0;1;Thu Jun 22 04:51:04 IST 2017;0;
examples of debuggers;http://searchsoftwarequality.techtarget.com/definition/debugging; In a large program that has thousands and thousands of lines of code, the debugging process can be made easier by using strategies such as unit tests, code reviews and pair programming;Code;code;0.43750000000000006;0.13450010335561222;0.06696428571428571;0.6389643890698979;0.0;1;Thu Jun 22 04:51:04 IST 2017;1;All articles needing additional references
examples of debuggers;http://searchsoftwarequality.techtarget.com/definition/debugging; In that case, unit tests __ such as JUnit and xUnit, which allow the programmer to run a specific function with specific inputs __ can be helpful in debugging;Programmer;programmers;0.25000000000000006;0.06725005167780611;0.32142857142857145;0.6386786231063777;0.0;1;Thu Jun 22 04:51:04 IST 2017;0;
examples of debuggers;http://www.cprogramming.com/gdb.html;The command to set a simple watchpoint  a write watchpoint, i;SETL;setl;0.25000000000000006;0.08006562756357671;0.23660714285714288;0.5666727704207196;0.0;1;Thu Jun 22 04:51:04 IST 2017;1;All articles needing additional references
examples of debuggers;http://www.sfu.ca/sasdoc/sashtml/lgref/z0379345.htm;To debug a DATA step, create a hypothesis about the logic error and test it by examining the values of variables at various points in the program;Crate;crate;0.25000000000000006;0.06495119787045253;0.18571428571428575;0.5006654835847383;0.0;1;Thu Jun 22 04:51:04 IST 2017;0;
examples of debuggers;https://docs.microsoft.com/en-us/windows-hardware/drivers/debugger/debugger-command-program-examples; Alias replacement occurs one time for the whole script when it is loaded and one time when each block is entered;Time;time;0.25000000000000006;0.08695652173913045;0.09523809523809523;0.4321946169772257;0.0;1;Thu Jun 22 04:51:04 IST 2017;0;
