examples of debuggers;https://en.wikipedia.org/wiki/Debugger;Most modern microprocessors have at least one of these features in their CPU design to make debugging easier;cpu_design;0.6250000000000001;0.026655014201441996;1.0;1.6516550142014421;0.0;1;Thu Jun 22 04:51:04 IST 2017
examples of debuggers;https://en.wikipedia.org/wiki/List_of_debuggers;FusionDebug   interactive debugger for Adobe ColdFusion, Railo, and Lucee CFML Engines;adobe_coldfusion;0.6250000000000001;0.021606304790578235;1.0;1.6466063047905783;0.0;1;Thu Jun 22 04:51:04 IST 2017
examples of debuggers;https://en.wikipedia.org/wiki/List_of_debuggers;Parasoft Insure     a multi_platform memory debugger;parasoft_insure++;0.6250000000000001;0.021606304790578235;1.0;1.6466063047905783;0.0;1;Thu Jun 22 04:51:04 IST 2017
examples of debuggers;https://en.wikipedia.org/wiki/List_of_debuggers;XPEDITER  family of mainframe debuggers;mainframe_(debuggers);0.6250000000000001;0.021606304790578235;1.0;1.6466063047905783;0.0;1;Thu Jun 22 04:51:04 IST 2017
examples of debuggers;https://en.wikipedia.org/wiki/List_of_debuggers;GDB GUI Emacs   Emacs editor with built_in support for the GNU Debugger acts as the frontend  KDbg   Part of the KDE development tools  Nemiver   A GDB frontend that integrates well in the GNOME desktop environment  xxgdb   X_window frontend for GDB and dbx debugger  Qt Creator   multi_platform frontend for GDB, CDB and LLDB  Allinea s DDT   a parallel and distributed front_end to a modified version of GDB  Xcode   contains a GDB front_end as well  SlickEdit   contains a GDB front_end as well  Eclipse C C   Development Tools  2    includes visual debugging tools based on GDB  CodeLite   An open source, cross platform C C   IDE which have front end for gdb, the next version of CodeLite will also include a front end to the LLDB CodeBlocks   A free cross_platform C, C   and Fortran IDE with a front end for gdb  RR   An open source C C   debugger by Mozilla, supporting reproduction of program state and reverse execution;version;0.43750000000000006;0.1944567431152041;1.0;1.6319567431152042;0.0;1;Thu Jun 22 04:51:04 IST 2017
examples of debuggers;https://www.tutorialspoint.com/gnu_debugger/gdb_debugging_examples.htm;Go through the following examples to understand the procedure of debugging a program and core dumped;procedure;0.25000000000000006;0.18944099378881987;1.0;1.43944099378882;0.0;1;Thu Jun 22 04:51:04 IST 2017
examples of debuggers;https://www.tutorialspoint.com/gnu_debugger/gdb_debugging_examples.htm;Developer s Best Practices;practice;0.25000000000000006;0.18944099378881987;1.0;1.43944099378882;0.0;1;Thu Jun 22 04:51:04 IST 2017
examples of debuggers;http://searchsoftwarequality.techtarget.com/definition/debugging;How enterprises can find the right deep learning use cases The world s top tech companies are currently the biggest users of deep learning applications, but more typical enterprises may be   ;enterprise;0.43750000000000006;0.0;1.0;1.4375;0.0;1;Thu Jun 22 04:51:04 IST 2017
examples of debuggers;https://docs.microsoft.com/en-us/windows-hardware/drivers/debugger/debugger-command-program-examples; The user_named aliases  Base and  Mod are used in this program;mod;0.25000000000000006;0.1739130434782609;1.0;1.423913043478261;0.0;1;Thu Jun 22 04:51:04 IST 2017
examples of debuggers;https://en.wikipedia.org/wiki/List_of_debuggers;GDB GUI Emacs   Emacs editor with built_in support for the GNU Debugger acts as the frontend  KDbg   Part of the KDE development tools  Nemiver   A GDB frontend that integrates well in the GNOME desktop environment  xxgdb   X_window frontend for GDB and dbx debugger  Qt Creator   multi_platform frontend for GDB, CDB and LLDB  Allinea s DDT   a parallel and distributed front_end to a modified version of GDB  Xcode   contains a GDB front_end as well  SlickEdit   contains a GDB front_end as well  Eclipse C C   Development Tools  2    includes visual debugging tools based on GDB  CodeLite   An open source, cross platform C C   IDE which have front end for gdb, the next version of CodeLite will also include a front end to the LLDB CodeBlocks   A free cross_platform C, C   and Fortran IDE with a front end for gdb  RR   An open source C C   debugger by Mozilla, supporting reproduction of program state and reverse execution;parallel;0.25000000000000006;0.17285043832462588;1.0;1.4228504383246259;0.0;1;Thu Jun 22 04:51:04 IST 2017
examples of debuggers;https://www.w3schools.com/js/js_debugging.asp;Debugging is the process of testing, finding, and reducing bugs in computer programs;process;0.25000000000000006;0.15952925792742725;1.0;1.4095292579274274;0.0;1;Thu Jun 22 04:51:04 IST 2017
examples of debuggers;https://docs.microsoft.com/en-us/windows-hardware/drivers/debugger/debugger-command-program-examples; Alias replacement occurs one time for the whole script when it is loaded and one time when each block is entered;blocks;0.25000000000000006;0.08695652173913045;1.0;1.3369565217391304;0.0;1;Thu Jun 22 04:51:04 IST 2017
examples of debuggers;http://www.sfu.ca/sasdoc/sashtml/lgref/z0379345.htm;An iterative DO, DO WHILE, or DO UNTIL statement can iterate many times during a single iteration of the DATA step;times;0.25000000000000006;0.08660159716060338;1.0;1.3366015971606036;0.0;1;Thu Jun 22 04:51:04 IST 2017
examples of debuggers;https://www.w3schools.com/js/js_debugging.asp;Otherwise follow these steps;steps;0.25000000000000006;0.07976462896371363;1.0;1.3297646289637137;0.0;1;Thu Jun 22 04:51:04 IST 2017
examples of debuggers;https://www.w3schools.com/js/js_debugging.asp;Go to Safari, Preferences, Advanced in the main menu ;advanced;0.25000000000000006;0.07976462896371363;1.0;1.3297646289637137;0.0;1;Thu Jun 22 04:51:04 IST 2017
examples of debuggers;https://en.wikipedia.org/wiki/List_of_debuggers;DBG   a PHP Debugger and Profiler;profiler;0.25000000000000006;0.04321260958115647;1.0;1.2932126095811565;0.0;1;Thu Jun 22 04:51:04 IST 2017
examples of debuggers;https://en.wikipedia.org/wiki/List_of_debuggers;DEBUG   the built_in debugger of DOS and Microsoft Windows;dos;0.25000000000000006;0.04321260958115647;1.0;1.2932126095811565;0.0;1;Thu Jun 22 04:51:04 IST 2017
examples of debuggers;http://www.cprogramming.com/gdb.html;Just starting and stopping isn t much of a control;control;0.25000000000000006;0.04003281378178836;1.0;1.2900328137817885;0.0;1;Thu Jun 22 04:51:04 IST 2017
examples of debuggers;http://www.cprogramming.com/gdb.html;You can modify variables to see if an issue is resolved if the variable has another value or to force the program to follow a particular path to see if the reason for a bug was due to a variable having the wrong value;path;0.25000000000000006;0.04003281378178836;1.0;1.2900328137817885;0.0;1;Thu Jun 22 04:51:04 IST 2017
examples of debuggers;http://www.cprogramming.com/gdb.html;You can modify variables to see if an issue is resolved if the variable has another value or to force the program to follow a particular path to see if the reason for a bug was due to a variable having the wrong value;bug;0.25000000000000006;0.04003281378178836;1.0;1.2900328137817885;0.0;1;Thu Jun 22 04:51:04 IST 2017
examples of debuggers;http://www.cprogramming.com/gdb.html; You can only set watchpoints for a variable when it is in scope;scope;0.25000000000000006;0.04003281378178836;1.0;1.2900328137817885;0.0;1;Thu Jun 22 04:51:04 IST 2017
examples of debuggers;http://www.cprogramming.com/gdb.html; Stepping into the function from that line;stepping;0.25000000000000006;0.04003281378178836;1.0;1.2900328137817885;0.0;1;Thu Jun 22 04:51:04 IST 2017
examples of debuggers;http://searchsoftwarequality.techtarget.com/definition/debugging; In that case, unit tests __ such as JUnit and xUnit, which allow the programmer to run a specific function with specific inputs __ can be helpful in debugging;case;0.25000000000000006;0.033625025838903054;1.0;1.283625025838903;0.0;1;Thu Jun 22 04:51:04 IST 2017
examples of debuggers;http://searchsoftwarequality.techtarget.com/definition/debugging;When deploying deep learning models into production, experts say it s important to take care of the basics, like model design and;basic;0.25000000000000006;0.033625025838903054;1.0;1.283625025838903;0.0;1;Thu Jun 22 04:51:04 IST 2017
examples of debuggers;http://searchsoftwarequality.techtarget.com/definition/debugging;When deploying deep learning models into production, experts say it s important to take care of the basics, like model design and;production;0.25000000000000006;0.033625025838903054;1.0;1.283625025838903;0.0;1;Thu Jun 22 04:51:04 IST 2017
examples of debuggers;http://searchsoftwarequality.techtarget.com/definition/debugging;After forming a new joint venture, LifeWorks, HCM vendor Ceridian uses LifeWorks  employee recognition, engagement and perks ;forcing;0.25000000000000006;0.033625025838903054;1.0;1.283625025838903;0.0;1;Thu Jun 22 04:51:04 IST 2017
examples of debuggers;http://searchsoftwarequality.techtarget.com/definition/debugging;Find the right recipe for mobile business apps;hrecipe;0.25000000000000006;0.033625025838903054;1.0;1.283625025838903;0.0;1;Thu Jun 22 04:51:04 IST 2017
examples of debuggers;https://en.wikipedia.org/wiki/Debugger; The code to be examined might alternatively be running on an instruction set simulator , a technique that allows great power in its ability to halt when specific conditions are encountered, but which will typically be somewhat slower than executing the code directly on the appropriate processor;techniques;0.25000000000000006;0.026655014201441996;1.0;1.2766550142014421;0.0;1;Thu Jun 22 04:51:04 IST 2017
examples of debuggers;https://en.wikipedia.org/wiki/Debugger; Some debuggers offer two modes of operation, full or partial simulation, to limit this impact;impact;0.25000000000000006;0.026655014201441996;1.0;1.2766550142014421;0.0;1;Thu Jun 22 04:51:04 IST 2017
examples of debuggers;https://en.wikipedia.org/wiki/Debugger; Some debuggers offer two modes of operation, full or partial simulation, to limit this impact;modes;0.25000000000000006;0.026655014201441996;1.0;1.2766550142014421;0.0;1;Thu Jun 22 04:51:04 IST 2017
examples of debuggers;https://en.wikipedia.org/wiki/Debugger; Various debuggers include this feature;features;0.25000000000000006;0.026655014201441996;1.0;1.2766550142014421;0.0;1;Thu Jun 22 04:51:04 IST 2017
examples of debuggers;https://en.wikipedia.org/wiki/Debugger; Eclipse debugger API used in a range of IDEs;ides;0.25000000000000006;0.026655014201441996;1.0;1.2766550142014421;0.0;1;Thu Jun 22 04:51:04 IST 2017
examples of debuggers;http://www.sfu.ca/sasdoc/sashtml/lgref/z0379345.htm; The program creates a report listing tour number, name, age, and sex for each customer;age;0.25000000000000006;0.021650399290150845;1.0;1.271650399290151;0.0;1;Thu Jun 22 04:51:04 IST 2017
examples of debuggers;http://www.sfu.ca/sasdoc/sashtml/lgref/z0379345.htm; Examine the values of all the variables to see their status at this point;status;0.25000000000000006;0.021650399290150845;1.0;1.271650399290151;0.0;1;Thu Jun 22 04:51:04 IST 2017
examples of debuggers;http://www.sfu.ca/sasdoc/sashtml/lgref/z0379345.htm; To display the day of the week and date, use the SAS WEEKDATEw;date;0.25000000000000006;0.021650399290150845;1.0;1.271650399290151;0.0;1;Thu Jun 22 04:51:04 IST 2017
examples of debuggers;https://en.wikipedia.org/wiki/List_of_debuggers;Ups   C, Fortran source level debugger;ups;0.25000000000000006;0.021606304790578235;1.0;1.2716063047905783;0.0;1;Thu Jun 22 04:51:04 IST 2017
examples of debuggers;http://searchsoftwarequality.techtarget.com/definition/debugging;Debugging, in computer programming and engineering, is a multistep process that involves identifying a problem, isolating the source of the problem, and then either correcting the problem or determining a way to work around it;sources;0.25000000000000006;0.016812512919451527;1.0;1.2668125129194516;0.0;1;Thu Jun 22 04:51:04 IST 2017
examples of debuggers;http://searchsoftwarequality.techtarget.com/definition/debugging; Other debugging tools include advanced logging and simulators that allow the programmer to model how an app on a mobile device will display and behave;model;0.25000000000000006;0.016812512919451527;1.0;1.2668125129194516;0.0;1;Thu Jun 22 04:51:04 IST 2017
examples of debuggers;http://searchsoftwarequality.techtarget.com/definition/debugging;Mobile app users want a consistent experience for all apps __ on all devices;devices;0.25000000000000006;0.016812512919451527;1.0;1.2668125129194516;0.0;1;Thu Jun 22 04:51:04 IST 2017
examples of debuggers;http://searchsoftwarequality.techtarget.com/definition/debugging;Models and Methodologies;models;0.25000000000000006;0.016812512919451527;1.0;1.2668125129194516;0.0;1;Thu Jun 22 04:51:04 IST 2017
examples of debuggers;http://searchsoftwarequality.techtarget.com/definition/debugging;Testing Tools and Frameworks;framework;0.25000000000000006;0.016812512919451527;1.0;1.2668125129194516;0.0;1;Thu Jun 22 04:51:04 IST 2017
examples of debuggers;http://searchsoftwarequality.techtarget.com/definition/debugging;Share this item with your network ;network;0.25000000000000006;0.016812512919451527;1.0;1.2668125129194516;0.0;1;Thu Jun 22 04:51:04 IST 2017
examples of debuggers;http://searchsoftwarequality.techtarget.com/definition/debugging;Mobile testing tutorial  Testers transition from Web to mobile apps;web;0.25000000000000006;0.016812512919451527;1.0;1.2668125129194516;0.0;1;Thu Jun 22 04:51:04 IST 2017
examples of debuggers;http://searchsoftwarequality.techtarget.com/definition/debugging;Connected care a focus for CEO of Philips North America For Brent Shafer, CEO of Philips North America, the name of the health IT game is connected care  Shafer explains that this is    ;focus;0.25000000000000006;0.016812512919451527;1.0;1.2668125129194516;0.0;1;Thu Jun 22 04:51:04 IST 2017
examples of debuggers;https://docs.microsoft.com/en-us/windows-hardware/drivers/debugger/debugger-command-program-examples; This command enables you to write readable programs by using multiple lines and indentation, instead of having to squeeze the whole program onto a single line;programs;0.25000000000000006;1.0;0.010416666666666666;1.2604166666666667;0.0;1;Thu Jun 22 04:51:04 IST 2017
examples of debuggers;https://en.wikipedia.org/wiki/Debugger; When the program  traps  or reaches a preset condition, the debugger typically shows the location in the original code if it is a source_level debugger or symbolic debugger, commonly now seen in integrated development environments;locations;0.25000000000000006;0.0;1.0;1.25;0.0;1;Thu Jun 22 04:51:04 IST 2017
examples of debuggers;https://en.wikipedia.org/wiki/Debugger; Micro controllers with as few as six pins need to use low pin_count substitutes for JTAG, such as BDM, Spy_Bi_Wire, or debugWIRE on the Atmel AVR;debugwire;0.25000000000000006;0.0;1.0;1.25;0.0;1;Thu Jun 22 04:51:04 IST 2017
examples of debuggers;https://en.wikipedia.org/wiki/Debugger;List of tools for static code analysis;list;0.25000000000000006;0.0;1.0;1.25;0.0;1;Thu Jun 22 04:51:04 IST 2017
examples of debuggers;https://en.wikipedia.org/wiki/Debugger;What links here;links;0.25000000000000006;0.0;1.0;1.25;0.0;1;Thu Jun 22 04:51:04 IST 2017
examples of debuggers;https://docs.microsoft.com/en-us/windows-hardware/drivers/debugger/debugger-command-program-examples; In the body of the loop,  t1 has the type ntdll _LDR_DATA_TABLE_ENTRY  , so the program can make direct member references;loop;0.25000000000000006;0.0;1.0;1.25;0.0;1;Thu Jun 22 04:51:04 IST 2017
examples of debuggers;https://docs.microsoft.com/en-us/windows-hardware/drivers/debugger/debugger-command-program-examples; Alias replacement occurs one time for the whole script when it is loaded and one time when each block is entered;loader;0.25000000000000006;0.0;1.0;1.25;0.0;1;Thu Jun 22 04:51:04 IST 2017
examples of debuggers;http://searchsoftwarequality.techtarget.com/definition/debugging; The debugging process starts as soon as code is written and continues in successive stages as code is combined with other units of programming to form a software product;programming;0.25000000000000006;0.0;1.0;1.25;0.0;1;Thu Jun 22 04:51:04 IST 2017
examples of debuggers;http://searchsoftwarequality.techtarget.com/definition/debugging; The term s application to computing and the inspiration for using the word debugging as a synonym for troubleshooting has been attributed to Admiral Grace Hopper, a pioneer in computer programming, who was also known for her dry sense of humor;applications;0.25000000000000006;0.0;1.0;1.25;0.0;1;Thu Jun 22 04:51:04 IST 2017
examples of debuggers;http://www.sfu.ca/sasdoc/sashtml/lgref/z0379345.htm; This means that SAS has compiled the step and will begin to execute the step at the top of the DATA step loop;sas;0.25000000000000006;0.0;1.0;1.25;0.0;1;Thu Jun 22 04:51:04 IST 2017
examples of debuggers;http://www.cprogramming.com/gdb.html;Gcc is the de facto compiler in Linux or any other  nix system;gcc;0.25000000000000006;0.0;1.0;1.25;0.0;1;Thu Jun 22 04:51:04 IST 2017
examples of debuggers;http://www.cprogramming.com/gdb.html;cpp containing your c   code;cpp;0.25000000000000006;0.0;1.0;1.25;0.0;1;Thu Jun 22 04:51:04 IST 2017
examples of debuggers;http://www.sfu.ca/sasdoc/sashtml/lgref/z0379345.htm;To end the debugging session, issue the QUIT command on the debugger command line;issues;0.25000000000000006;0.28145519077196096;0.4910714285714286;1.0225266193433895;0.0;1;Thu Jun 22 04:51:04 IST 2017
examples of debuggers;http://www.cprogramming.com/gdb.html; Whenever a change occurs, the program pauses and provides you with the details of the change;change;0.43750000000000006;0.04003281378178836;0.4910714285714286;0.9686042423532171;0.0;1;Thu Jun 22 04:51:04 IST 2017
examples of debuggers;https://en.wikipedia.org/wiki/List_of_debuggers;GDB GUI Emacs   Emacs editor with built_in support for the GNU Debugger acts as the frontend  KDbg   Part of the KDE development tools  Nemiver   A GDB frontend that integrates well in the GNOME desktop environment  xxgdb   X_window frontend for GDB and dbx debugger  Qt Creator   multi_platform frontend for GDB, CDB and LLDB  Allinea s DDT   a parallel and distributed front_end to a modified version of GDB  Xcode   contains a GDB front_end as well  SlickEdit   contains a GDB front_end as well  Eclipse C C   Development Tools  2    includes visual debugging tools based on GDB  CodeLite   An open source, cross platform C C   IDE which have front end for gdb, the next version of CodeLite will also include a front end to the LLDB CodeBlocks   A free cross_platform C, C   and Fortran IDE with a front end for gdb  RR   An open source C C   debugger by Mozilla, supporting reproduction of program state and reverse execution;ide;0.43750000000000006;0.1944567431152041;0.32142857142857145;0.9533853145437756;0.0;1;Thu Jun 22 04:51:04 IST 2017
examples of debuggers;http://www.sfu.ca/sasdoc/sashtml/lgref/z0379345.htm; One type contains the tour code, and the other type contains customer information;type3;0.25000000000000006;0.08660159716060338;0.4910714285714286;0.827673025732032;0.0;1;Thu Jun 22 04:51:04 IST 2017
examples of debuggers;http://searchsoftwarequality.techtarget.com/definition/debugging; Debugging is part of the software testing process and is an integral part of the entire software development lifecycle;part;0.43750000000000006;0.050437538758354585;0.32142857142857145;0.8093661101869261;0.0;1;Thu Jun 22 04:51:04 IST 2017
examples of debuggers;https://en.wikipedia.org/wiki/Debugger; Reverse debugging is very useful for certain types of problems, but is still not commonly used yet;types;0.25000000000000006;0.026655014201441996;0.4910714285714286;0.7677264427728707;0.0;1;Thu Jun 22 04:51:04 IST 2017
examples of debuggers;https://en.wikipedia.org/wiki/Debugger;Comparison of debuggers;comparisons;0.25000000000000006;0.026655014201441996;0.4910714285714286;0.7677264427728707;0.0;1;Thu Jun 22 04:51:04 IST 2017
examples of debuggers;https://www.w3schools.com/js/js_debugging.asp;Errors can happen, every time you write some new computer code;tappen;0.25000000000000006;0.15952925792742725;0.32142857142857145;0.7309578293559988;0.0;1;Thu Jun 22 04:51:04 IST 2017
examples of debuggers;https://en.wikipedia.org/wiki/Debugger; Debuggers also offer more sophisticated functions such as running a program step by step , stopping at some event or specified instruction by means of a breakpoint, and tracking the values of variables;step;0.43750000000000006;0.05331002840288399;0.18571428571428575;0.6765243141171698;0.0;1;Thu Jun 22 04:51:04 IST 2017
examples of debuggers;https://docs.microsoft.com/en-us/windows-hardware/drivers/debugger/debugger-command-program-examples;Note If you want to operate on the variable name in the OutCommands portion of the command, you must add a space after the variable name;notes;0.25000000000000006;0.1739130434782609;0.23660714285714288;0.6605201863354039;0.0;1;Thu Jun 22 04:51:04 IST 2017
examples of debuggers;http://www.sfu.ca/sasdoc/sashtml/lgref/z0379345.htm;This example shows how to debug a DATA step when output is missing;outputs;0.25000000000000006;0.06495119787045253;0.32142857142857145;0.6363797692990241;0.0;1;Thu Jun 22 04:51:04 IST 2017
examples of debuggers;https://en.wikipedia.org/wiki/Debugger;Edit;edit;0.25000000000000006;0.026655014201441996;0.32142857142857145;0.5980835856300135;0.0;1;Thu Jun 22 04:51:04 IST 2017
examples of debuggers;https://www.tutorialspoint.com/gnu_debugger/gdb_debugging_examples.htm;Go through the following examples to understand the procedure of debugging a program and core dumped;examples;0.25000000000000006;0.18944099378881987;0.15178571428571427;0.5912267080745343;0.0;1;Thu Jun 22 04:51:04 IST 2017
