examples of debuggers;https://en.wikipedia.org/wiki/Debugger; When the program  traps  or reaches a preset condition, the debugger typically shows the location in the original code if it is a source_level debugger or symbolic debugger, commonly now seen in integrated development environments;Integrated development environment;integrated_development_environment;1.0;0.026655014201441996;1.0;2.0266550142014417;0.0;1;Thu Jun 22 04:51:04 IST 2017;0;
examples of debuggers;https://en.wikipedia.org/wiki/Debugger;List of tools for static code analysis;Static program analysis;static_code_analysis;1.0;0.026655014201441996;1.0;2.0266550142014417;0.0;1;Thu Jun 22 04:51:04 IST 2017;0;
examples of debuggers;http://searchsoftwarequality.techtarget.com/definition/debugging;User Acceptance Testing;Acceptance testing;user_acceptance_testing;1.0;0.016812512919451527;1.0;2.0168125129194516;0.0;1;Thu Jun 22 04:51:04 IST 2017;1;All articles needing additional references
examples of debuggers;http://searchsoftwarequality.techtarget.com/definition/debugging;Software Performance Testing;Software performance testing;software_performance_testing;1.0;0.016812512919451527;1.0;2.0168125129194516;0.0;1;Thu Jun 22 04:51:04 IST 2017;0;
examples of debuggers;https://www.w3schools.com/js/js_debugging.asp; The first known computer bug was a real bug stuck in the electronics;Software bug;computer_bug;0.7187500000000001;0.15952925792742725;1.0;1.8782792579274274;0.0;1;Thu Jun 22 04:51:04 IST 2017;0;
examples of debuggers;http://searchsoftwarequality.techtarget.com/definition/debugging;How enterprises can find the right deep learning use cases The world s top tech companies are currently the biggest users of deep learning applications, but more typical enterprises may be   ;Deep learning;deep_learning;0.8125;0.016812512919451527;1.0;1.8293125129194516;0.0;1;Thu Jun 22 04:51:04 IST 2017;1;CS1 maint: Uses editors parameter
examples of debuggers;https://en.wikipedia.org/wiki/List_of_debuggers;GDB GUI Emacs   Emacs editor with built_in support for the GNU Debugger acts as the frontend  KDbg   Part of the KDE development tools  Nemiver   A GDB frontend that integrates well in the GNOME desktop environment  xxgdb   X_window frontend for GDB and dbx debugger  Qt Creator   multi_platform frontend for GDB, CDB and LLDB  Allinea s DDT   a parallel and distributed front_end to a modified version of GDB  Xcode   contains a GDB front_end as well  SlickEdit   contains a GDB front_end as well  Eclipse C C   Development Tools  2    includes visual debugging tools based on GDB  CodeLite   An open source, cross platform C C   IDE which have front end for gdb, the next version of CodeLite will also include a front end to the LLDB CodeBlocks   A free cross_platform C, C   and Fortran IDE with a front end for gdb  RR   An open source C C   debugger by Mozilla, supporting reproduction of program state and reverse execution;Cross-platform;cross-platform;0.6250000000000001;0.1944567431152041;1.0;1.8194567431152042;0.0;1;Thu Jun 22 04:51:04 IST 2017;1;All articles needing additional references
examples of debuggers;https://www.w3schools.com/js/js_debugging.asp; There are no error messages, and you will get no indications where to search for errors;Error message;error_messages;0.6250000000000001;0.15952925792742725;1.0;1.7845292579274274;0.0;1;Thu Jun 22 04:51:04 IST 2017;1;All articles needing additional references
examples of debuggers;https://en.wikipedia.org/wiki/Debugger; An instruction set that meets the Popek and Goldberg virtualization requirements makes it easier to write debugger software that runs on the same CPU as the software being debugged  such a CPU can execute the inner loops of the program under test at full speed, and still remain under debugger control;Instruction set architecture;instruction_set;0.6250000000000001;0.10662005680576798;1.0;1.731620056805768;0.0;1;Thu Jun 22 04:51:04 IST 2017;0;
examples of debuggers;https://docs.microsoft.com/en-us/windows-hardware/drivers/debugger/debugger-command-program-examples;echo command does not receive the values of the  Mod and  Base aliases that are assigned in the previous lines;Echo (command);echo_(command);0.6250000000000001;0.08695652173913045;1.0;1.7119565217391306;0.0;1;Thu Jun 22 04:51:04 IST 2017;0;
examples of debuggers;https://en.wikipedia.org/wiki/Debugger; Micro controllers with as few as six pins need to use low pin_count substitutes for JTAG, such as BDM, Spy_Bi_Wire, or debugWIRE on the Atmel AVR;Microcontroller;microcontrollers;0.6250000000000001;0.05331002840288399;1.0;1.6783100284028842;0.0;1;Thu Jun 22 04:51:04 IST 2017;2;All articles lacking in-text citations::All articles needing additional references
examples of debuggers;http://searchsoftwarequality.techtarget.com/definition/debugging;Debugging, in computer programming and engineering, is a multistep process that involves identifying a problem, isolating the source of the problem, and then either correcting the problem or determining a way to work around it;Computer programming;computer_programming;0.6250000000000001;0.050437538758354585;1.0;1.6754375387583547;0.0;1;Thu Jun 22 04:51:04 IST 2017;1;All articles needing additional references
examples of debuggers;http://searchsoftwarequality.techtarget.com/definition/debugging;Beware the dreaded scourge of cloud sprawl  Act now or lose control The cloud was supposed to save us  So, why are we now suffering from dreaded cloud sprawl, and what should we do about it  Cloud    ;Cloud;cloud;0.6250000000000001;0.050437538758354585;1.0;1.6754375387583547;0.0;1;Thu Jun 22 04:51:04 IST 2017;0;
examples of debuggers;https://docs.microsoft.com/en-us/windows-hardware/drivers/debugger/debugger-command-program-examples; This command loads the whole file, replaces all carriage returns with semicolons, and executes the resulting block;Carriage return;carriage_return;0.6250000000000001;0.04347826086956522;1.0;1.6684782608695654;0.0;1;Thu Jun 22 04:51:04 IST 2017;1;All articles needing additional references
examples of debuggers;http://www.cprogramming.com/gdb.html; Some important topics have not been touched upon here for the sake of simplicity, such as dealing with segmentation faults and other kinds of crashes or using tools like Valgrind to find memory leaks;Segmentation fault;segmentation_fault;0.6250000000000001;0.04003281378178836;1.0;1.6650328137817885;0.0;1;Thu Jun 22 04:51:04 IST 2017;1;All articles needing additional references
examples of debuggers;http://searchsoftwarequality.techtarget.com/definition/debugging;How is big data and IT helping the agriculture industry  By looking at information in new ways, technology is helping to improve ;Big data;big_data;0.6250000000000001;0.033625025838903054;1.0;1.6586250258389033;0.0;1;Thu Jun 22 04:51:04 IST 2017;1;CS1 maint: Uses editors parameter
examples of debuggers;http://searchsoftwarequality.techtarget.com/definition/debugging;For Brent Shafer, CEO of Philips North America, the name of the health IT game is connected care;Connected car;connected_car;0.6250000000000001;0.033625025838903054;1.0;1.6586250258389033;0.0;1;Thu Jun 22 04:51:04 IST 2017;0;
examples of debuggers;http://searchsoftwarequality.techtarget.com/definition/debugging;The future of software testing  It s a brave new world;Software testing;software_testing;0.6250000000000001;0.033625025838903054;1.0;1.6586250258389033;0.0;1;Thu Jun 22 04:51:04 IST 2017;0;
examples of debuggers;https://en.wikipedia.org/wiki/Debugger; The code to be examined might alternatively be running on an instruction set simulator , a technique that allows great power in its ability to halt when specific conditions are encountered, but which will typically be somewhat slower than executing the code directly on the appropriate processor;Great power;great_power;0.6250000000000001;0.026655014201441996;1.0;1.6516550142014421;0.0;1;Thu Jun 22 04:51:04 IST 2017;1;CS1 maint: Uses authors parameter
examples of debuggers;https://en.wikipedia.org/wiki/Debugger; In_system programming allows an external hardware debugger to reprogram a system under test ;In-system programming;in-system_programming;0.6250000000000001;0.026655014201441996;1.0;1.6516550142014421;0.0;1;Thu Jun 22 04:51:04 IST 2017;1;All articles needing additional references
examples of debuggers;https://en.wikipedia.org/wiki/Debugger;Jonathan B  Rosenberg  How Debuggers Work  Algorithms, Data Structures, and Architecture  John Wiley   Sons  ISBN 0_471_14966_7  CS1 maint  Uses authors parameter ;Data structure;data_structures;0.6250000000000001;0.026655014201441996;1.0;1.6516550142014421;0.0;1;Thu Jun 22 04:51:04 IST 2017;1;All articles needing additional references
examples of debuggers;https://en.wikipedia.org/wiki/List_of_debuggers;DEBUG   the built_in debugger of DOS and Microsoft Windows;Microsoft Windows;microsoft_windows;0.6250000000000001;0.021606304790578235;1.0;1.6466063047905783;0.0;1;Thu Jun 22 04:51:04 IST 2017;0;
examples of debuggers;https://en.wikipedia.org/wiki/List_of_debuggers;Lauterbach TRACE32   in_circuit debugger for embedded Systems;Embedded system;embedded_systems;0.6250000000000001;0.021606304790578235;1.0;1.6466063047905783;0.0;1;Thu Jun 22 04:51:04 IST 2017;0;
examples of debuggers;https://en.wikipedia.org/wiki/List_of_debuggers;xxgdb   X_window frontend for GDB and dbx debugger ;Dbx (debugger);dbx_debugger;0.6250000000000001;0.021606304790578235;1.0;1.6466063047905783;0.0;1;Thu Jun 22 04:51:04 IST 2017;2;All articles needing additional references::Debuggers
examples of debuggers;http://searchsoftwarequality.techtarget.com/definition/debugging;Some tools, especially open source tools and scripting languages, do not run in an IDE and require a more manual approach to debugging;Scripting language;scripting_languages;0.6250000000000001;0.016812512919451527;1.0;1.6418125129194516;0.0;1;Thu Jun 22 04:51:04 IST 2017;1;All articles needing additional references
examples of debuggers;http://searchsoftwarequality.techtarget.com/definition/debugging;Project Management;Project management;project_management;0.6250000000000001;0.016812512919451527;1.0;1.6418125129194516;0.0;1;Thu Jun 22 04:51:04 IST 2017;0;
examples of debuggers;http://searchsoftwarequality.techtarget.com/definition/debugging;Regression Testing;Regression testing;regression_testing;0.6250000000000001;0.016812512919451527;1.0;1.6418125129194516;0.0;1;Thu Jun 22 04:51:04 IST 2017;0;
examples of debuggers;http://searchsoftwarequality.techtarget.com/definition/debugging;Why continuous testing is gaining ground, but not enough;Continuous testing;continuous_testing;0.6250000000000001;0.016812512919451527;1.0;1.6418125129194516;0.0;1;Thu Jun 22 04:51:04 IST 2017;0;
examples of debuggers;http://searchsoftwarequality.techtarget.com/definition/debugging;Site Map;Sitemaps;sitemaps;0.6250000000000001;0.016812512919451527;1.0;1.6418125129194516;0.0;1;Thu Jun 22 04:51:04 IST 2017;0;
examples of debuggers;https://www.w3schools.com/js/js_debugging.asp;At each breakpoint, JavaScript will stop executing, and let you examine JavaScript values;JavaScript;javascript;0.6250000000000001;0.0;1.0;1.625;0.0;1;Thu Jun 22 04:51:04 IST 2017;0;
examples of debuggers;https://www.tutorialspoint.com/gnu_debugger/gdb_debugging_examples.htm;Google ;Google+;google+;0.25000000000000006;0.18944099378881987;1.0;1.43944099378882;0.0;1;Thu Jun 22 04:51:04 IST 2017;0;
examples of debuggers;https://www.tutorialspoint.com/gnu_debugger/gdb_debugging_examples.htm;Developer s Best Practices;JDeveloper;jdeveloper;0.25000000000000006;0.18944099378881987;1.0;1.43944099378882;0.0;1;Thu Jun 22 04:51:04 IST 2017;0;
examples of debuggers;http://searchsoftwarequality.techtarget.com/definition/debugging;Genomics in healthcare is ready now, experts say Despite some health IT experts saying that certain challenges are keeping genomics in healthcare from happening, there are other    ;Genomics;genomics;0.43750000000000006;0.0;1.0;1.4375;0.0;1;Thu Jun 22 04:51:04 IST 2017;0;
examples of debuggers;http://www.sfu.ca/sasdoc/sashtml/lgref/z0379345.htm; Viewing the SAS log will not help you debug the program because the data are valid and no errors appear in the log;Logo;logo;0.43750000000000006;0.0;1.0;1.4375;0.0;1;Thu Jun 22 04:51:04 IST 2017;0;
examples of debuggers;https://docs.microsoft.com/en-us/windows-hardware/drivers/debugger/debugger-command-program-examples;Note If you want to operate on the variable name in the OutCommands portion of the command, you must add a space after the variable name;Space;space;0.25000000000000006;0.1739130434782609;1.0;1.423913043478261;0.0;1;Thu Jun 22 04:51:04 IST 2017;0;
examples of debuggers;https://docs.microsoft.com/en-us/windows-hardware/drivers/debugger/debugger-command-program-examples; This token causes the program to use the C   expression evaluator to parse the expression within the parentheses;Parsec;parsec;0.25000000000000006;0.1739130434782609;1.0;1.423913043478261;0.0;1;Thu Jun 22 04:51:04 IST 2017;0;
examples of debuggers;https://docs.microsoft.com/en-us/windows-hardware/drivers/debugger/debugger-command-program-examples;   token interprets the alias literally, preventing it from being replaced if it was defined before the script is run;JScript;jscript;0.25000000000000006;0.1739130434782609;1.0;1.423913043478261;0.0;1;Thu Jun 22 04:51:04 IST 2017;0;
examples of debuggers;https://www.w3schools.com/js/js_debugging.asp;If your browser supports debugging, you can use console;Consolas;consolas;0.25000000000000006;0.15952925792742725;1.0;1.4095292579274274;0.0;1;Thu Jun 22 04:51:04 IST 2017;0;
examples of debuggers;http://searchsoftwarequality.techtarget.com/definition/debugging;For Brent Shafer, CEO of Philips North America, the name of the health IT game is connected care;EHealth;ehealth;0.25000000000000006;0.10087507751670917;1.0;1.3508750775167093;0.0;1;Thu Jun 22 04:51:04 IST 2017;0;
examples of debuggers;http://www.cprogramming.com/gdb.html;Starting out;Starling;starling;0.25000000000000006;0.08006562756357671;1.0;1.3300656275635767;0.0;1;Thu Jun 22 04:51:04 IST 2017;1;CS1 maint: Uses editors parameter
examples of debuggers;http://www.cprogramming.com/gdb.html;A good debugger is one of the most important tools in a programmer s toolkit;List of toolkits;toolkit;0.25000000000000006;0.08006562756357671;1.0;1.3300656275635767;0.0;1;Thu Jun 22 04:51:04 IST 2017;0;
examples of debuggers;https://www.w3schools.com/js/js_debugging.asp;After examining values, you can resume the execution of code ;Résumé;resume;0.25000000000000006;0.07976462896371363;1.0;1.3297646289637137;0.0;1;Thu Jun 22 04:51:04 IST 2017;1;All articles needing additional references
examples of debuggers;https://www.w3schools.com/js/js_debugging.asp;Go to Safari, Preferences, Advanced in the main menu ;Safari;safari;0.25000000000000006;0.07976462896371363;1.0;1.3297646289637137;0.0;1;Thu Jun 22 04:51:04 IST 2017;1;All articles needing additional references
examples of debuggers;http://searchsoftwarequality.techtarget.com/definition/debugging;Understand respected criteria for quality assurance, tracking changes, and see a review of 5 great tools for developers;EViews;eviews;0.25000000000000006;0.06725005167780611;1.0;1.317250051677806;0.0;1;Thu Jun 22 04:51:04 IST 2017;0;
examples of debuggers;http://searchsoftwarequality.techtarget.com/definition/debugging; In a large program that has thousands and thousands of lines of code, the debugging process can be made easier by using strategies such as unit tests, code reviews and pair programming;Strategy;strategies;0.25000000000000006;0.06725005167780611;1.0;1.317250051677806;0.0;1;Thu Jun 22 04:51:04 IST 2017;0;
examples of debuggers;http://searchsoftwarequality.techtarget.com/definition/debugging;What s the future of software testing  Start with data science;Future;future;0.25000000000000006;0.06725005167780611;1.0;1.317250051677806;0.0;1;Thu Jun 22 04:51:04 IST 2017;0;
examples of debuggers;http://www.sfu.ca/sasdoc/sashtml/lgref/z0379345.htm; Viewing the SAS log will not help you debug the program because the data are valid and no errors appear in the log;Data;data;0.25000000000000006;0.06495119787045253;1.0;1.3149511978704527;0.0;1;Thu Jun 22 04:51:04 IST 2017;0;
examples of debuggers;https://en.wikipedia.org/wiki/Debugger; The code to be examined might alternatively be running on an instruction set simulator , a technique that allows great power in its ability to halt when specific conditions are encountered, but which will typically be somewhat slower than executing the code directly on the appropriate processor;Agility;agility;0.25000000000000006;0.05331002840288399;1.0;1.303310028402884;0.0;1;Thu Jun 22 04:51:04 IST 2017;0;
examples of debuggers;http://searchsoftwarequality.techtarget.com/definition/debugging; Navy s first computer, Admiral Hopper and her team  debugged  the computer and saved the moth;Computer;computer;0.25000000000000006;0.050437538758354585;1.0;1.3004375387583547;0.0;1;Thu Jun 22 04:51:04 IST 2017;1;All articles needing additional references
examples of debuggers;http://searchsoftwarequality.techtarget.com/definition/debugging;Microsoft delivers Draft, a new tool that simplifies Kubernetes cluster management by easing the development and deployment of ;Tool;tool;0.25000000000000006;0.050437538758354585;1.0;1.3004375387583547;0.0;1;Thu Jun 22 04:51:04 IST 2017;1;CS1 maint: Uses editors parameter
examples of debuggers;http://searchsoftwarequality.techtarget.com/definition/debugging;The future of software testing  It s a brave new world;World;world;0.25000000000000006;0.050437538758354585;1.0;1.3004375387583547;0.0;1;Thu Jun 22 04:51:04 IST 2017;0;
examples of debuggers;https://docs.microsoft.com/en-us/windows-hardware/drivers/debugger/debugger-command-program-examples;The preceding example uses the      token to make sure aliases are replaced even if they are next to other text;Precoding;precoding;0.25000000000000006;0.04347826086956522;1.0;1.2934782608695654;0.0;1;Thu Jun 22 04:51:04 IST 2017;0;
examples of debuggers;http://www.sfu.ca/sasdoc/sashtml/lgref/z0379345.htm; Issue debugger commands in this window by typing commands on the debugger command line ;Microsoft Windows;windows;0.25000000000000006;0.04330079858030169;1.0;1.2933007985803018;0.0;1;Thu Jun 22 04:51:04 IST 2017;0;
examples of debuggers;http://www.sfu.ca/sasdoc/sashtml/lgref/z0379345.htm; This means that SAS has compiled the step and will begin to execute the step at the top of the DATA step loop;Compiler;compiler;0.25000000000000006;0.04330079858030169;1.0;1.2933007985803018;0.0;1;Thu Jun 22 04:51:04 IST 2017;4;All articles needing additional references::CS1 maint: Uses authors parameter::CS1 maint: Uses editors parameter::Utility software types
examples of debuggers;http://www.cprogramming.com/gdb.html;References;Reference;references;0.25000000000000006;0.04003281378178836;1.0;1.2900328137817885;0.0;1;Thu Jun 22 04:51:04 IST 2017;0;
examples of debuggers;http://www.cprogramming.com/gdb.html;Provided you ve compiled your program with the debugging symbols enabled, you re ready to start debugging;ProvideX;providex;0.25000000000000006;0.04003281378178836;1.0;1.2900328137817885;0.0;1;Thu Jun 22 04:51:04 IST 2017;0;
examples of debuggers;http://www.cprogramming.com/gdb.html; The command for this purpose is  list ;Intention;purpose;0.25000000000000006;0.04003281378178836;1.0;1.2900328137817885;0.0;1;Thu Jun 22 04:51:04 IST 2017;0;
examples of debuggers;http://www.cprogramming.com/gdb.html; There is a little difference between the two, though;Différance;differance;0.25000000000000006;0.04003281378178836;1.0;1.2900328137817885;0.0;1;Thu Jun 22 04:51:04 IST 2017;1;All articles needing additional references
examples of debuggers;http://www.cprogramming.com/gdb.html;If you use the next command, the line gets executed and the control advances to the next line, readinput, where you can perhaps examine  value  to get an idea of how displayworked;Idea;ideas;0.25000000000000006;0.04003281378178836;1.0;1.2900328137817885;0.0;1;Thu Jun 22 04:51:04 IST 2017;2;All articles lacking in-text citations::All articles needing additional references
examples of debuggers;http://www.cprogramming.com/gdb.html;You can modify variables to see if an issue is resolved if the variable has another value or to force the program to follow a particular path to see if the reason for a bug was due to a variable having the wrong value;Reason;reason;0.25000000000000006;0.04003281378178836;1.0;1.2900328137817885;0.0;1;Thu Jun 22 04:51:04 IST 2017;0;
examples of debuggers;http://www.cprogramming.com/gdb.html; Some important topics have not been touched upon here for the sake of simplicity, such as dealing with segmentation faults and other kinds of crashes or using tools like Valgrind to find memory leaks;Simplicity;simplicity;0.25000000000000006;0.04003281378178836;1.0;1.2900328137817885;0.0;1;Thu Jun 22 04:51:04 IST 2017;1;All articles lacking in-text citations
examples of debuggers;http://www.cprogramming.com/gdb.html; For details about a specific command, use the syntax;Syntax;syntax;0.25000000000000006;0.04003281378178836;1.0;1.2900328137817885;0.0;1;Thu Jun 22 04:51:04 IST 2017;0;
examples of debuggers;http://searchsoftwarequality.techtarget.com/definition/debugging;By submitting my Email address I confirm that I have read and accepted the Terms of Use and Declaration of Consent;Consent;consent;0.25000000000000006;0.033625025838903054;1.0;1.283625025838903;0.0;1;Thu Jun 22 04:51:04 IST 2017;0;
examples of debuggers;http://searchsoftwarequality.techtarget.com/definition/debugging;How is big data and IT helping the agriculture industry  By looking at information in new ways, technology is helping to improve ;Technology;technology;0.25000000000000006;0.033625025838903054;1.0;1.283625025838903;0.0;1;Thu Jun 22 04:51:04 IST 2017;0;
examples of debuggers;http://searchsoftwarequality.techtarget.com/definition/debugging;How is big data and IT helping the agriculture industry  By looking at information in new ways, technology is helping to improve ;Improvement;improve;0.25000000000000006;0.033625025838903054;1.0;1.283625025838903;0.0;1;Thu Jun 22 04:51:04 IST 2017;0;
examples of debuggers;http://searchsoftwarequality.techtarget.com/definition/debugging;When deploying deep learning models into production, experts say it s important to take care of the basics, like model design and;Caret;caret;0.25000000000000006;0.033625025838903054;1.0;1.283625025838903;0.0;1;Thu Jun 22 04:51:04 IST 2017;0;
examples of debuggers;http://searchsoftwarequality.techtarget.com/definition/debugging;Retailers such as Walmart are beginning to offer self_service health kiosks that allow patients to check their vital signs while ;Patent;patents;0.25000000000000006;0.033625025838903054;1.0;1.283625025838903;0.0;1;Thu Jun 22 04:51:04 IST 2017;0;
examples of debuggers;http://searchsoftwarequality.techtarget.com/definition/debugging;News;News;news;0.25000000000000006;0.033625025838903054;1.0;1.283625025838903;0.0;1;Thu Jun 22 04:51:04 IST 2017;0;
examples of debuggers;http://searchsoftwarequality.techtarget.com/definition/debugging;Buyer s Guides;Guide;guide;0.25000000000000006;0.033625025838903054;1.0;1.283625025838903;0.0;1;Thu Jun 22 04:51:04 IST 2017;0;
examples of debuggers;http://searchsoftwarequality.techtarget.com/definition/debugging;Opinions;Opinion;opinion;0.25000000000000006;0.033625025838903054;1.0;1.283625025838903;0.0;1;Thu Jun 22 04:51:04 IST 2017;0;
examples of debuggers;http://searchsoftwarequality.techtarget.com/definition/debugging;A primer on automated API testing;Prime number;prime;0.25000000000000006;0.033625025838903054;1.0;1.283625025838903;0.0;1;Thu Jun 22 04:51:04 IST 2017;0;
examples of debuggers;https://en.wikipedia.org/wiki/Debugger; Many systems with such ISP support also have other hardware debug support;System;systems;0.25000000000000006;0.026655014201441996;1.0;1.2766550142014421;0.0;1;Thu Jun 22 04:51:04 IST 2017;0;
examples of debuggers;http://www.sfu.ca/sasdoc/sashtml/lgref/z0379345.htm; The program data vector gets reset to missing values at the beginning of each iteration and therefore does not retain the value of Tour;Retail;retail;0.25000000000000006;0.021650399290150845;1.0;1.271650399290151;0.0;1;Thu Jun 22 04:51:04 IST 2017;0;
examples of debuggers;http://www.sfu.ca/sasdoc/sashtml/lgref/z0379345.htm;Issue the EXAMINE command to display the current value of all variables;Curren;curren;0.25000000000000006;0.021650399290150845;1.0;1.271650399290151;0.0;1;Thu Jun 22 04:51:04 IST 2017;0;
examples of debuggers;http://www.sfu.ca/sasdoc/sashtml/lgref/z0379345.htm; To display the day of the week and date, use the SAS WEEKDATEw;Week;week;0.25000000000000006;0.021650399290150845;1.0;1.271650399290151;0.0;1;Thu Jun 22 04:51:04 IST 2017;0;
examples of debuggers;http://www.sfu.ca/sasdoc/sashtml/lgref/z0379345.htm; To display the day of the week and date, use the SAS WEEKDATEw;Day;day;0.25000000000000006;0.021650399290150845;1.0;1.271650399290151;0.0;1;Thu Jun 22 04:51:04 IST 2017;0;
examples of debuggers;http://searchsoftwarequality.techtarget.com/definition/debugging; In some cases, the module that presents the problem is obvious, while the line of code itself is not;Present;present;0.25000000000000006;0.016812512919451527;1.0;1.2668125129194516;0.0;1;Thu Jun 22 04:51:04 IST 2017;0;
examples of debuggers;http://searchsoftwarequality.techtarget.com/definition/debugging; Privacy;Privacy;privacy;0.25000000000000006;0.016812512919451527;1.0;1.2668125129194516;0.0;1;Thu Jun 22 04:51:04 IST 2017;1;CS1 maint: Uses editors parameter
examples of debuggers;http://searchsoftwarequality.techtarget.com/definition/debugging;Choose your talent management system wisely or risk irking your employees;Employment;employee;0.25000000000000006;0.016812512919451527;1.0;1.2668125129194516;0.0;1;Thu Jun 22 04:51:04 IST 2017;0;
