algorithms in mlpack;http://www.mlpack.org/about.html; Neighborhood components analysis .;Neighbourhood components analysis;neighborhood_components_analysis;1.0;0.07;1.0;2.0700000000000003;0.0;0;Mon Jun 26 19:39:36 IST 2017
algorithms in mlpack;http://www.mlpack.org/about.html; Range search with dual_tree algorithms .;Range searching;range_search;0.6;0.07;1.0;1.67;0.0;0;Mon Jun 26 19:39:36 IST 2017
algorithms in mlpack;http://www.mlpack.org/about.html; Sparse coding with dictionary learning .;Machine learning;dictionary_learning;0.6;0.07;1.0;1.67;0.0;0;Mon Jun 26 19:39:36 IST 2017
algorithms in mlpack;http://www.mlpack.org/about.html; Originally, it was produced by the FASTLab at Georgia Tech, but it has since grown into a much larger effort.;Georgia Institute of Technology;georgia_tech;0.6;0.07;1.0;1.67;0.7071067811865475;0;Mon Jun 26 19:39:36 IST 2017
algorithms in mlpack;https://summerofcode.withgoogle.com/archive/2016/organizations/5115751115522048/; Its aim is to make machine learning possible for novice users by means of a simple, consistent API, while simultaneously exploiting C   language features to provide maximum performance and maximum flexibility for expert users.;Literal and figurative language;language_features;0.6;0.5;0.4;1.5;0.7071067811865475;0;Mon Jun 26 19:39:36 IST 2017
algorithms in mlpack;https://summerofcode.withgoogle.com/archive/2016/organizations/5115751115522048/; This is done by providing a set of command_line executables which can be used as black boxes, and a modular C   API for expert users and researchers to easily make changes to the internals of the algorithms.;Black box;black_boxes;0.6;0.5;0.4;1.5;0.0;0;Mon Jun 26 19:39:36 IST 2017
algorithms in mlpack;https://en.wikipedia.org/wiki/MLPACK_(C%252B%252B_library); Neighbourhood Components Analysis .;Neighbourhood components analysis;neighbourhood_components_analysis;1.0;0.0;0.4;1.4;0.0;0;Mon Jun 26 19:39:36 IST 2017
algorithms in mlpack;https://en.wikipedia.org/wiki/MLPACK_(C%252B%252B_library); Independent component analysis .;Independent component analysis;independent_component_analysis;1.0;0.0;0.4;1.4;0.0;0;Mon Jun 26 19:39:36 IST 2017
algorithms in mlpack;http://www.mlpack.org/about.html; Least_angle regression .;Least-angle regression;least_angle_regression;0.6;0.07;0.4;1.0699999999999998;0.0;0;Mon Jun 26 19:39:36 IST 2017
